Handle,Title,Body (HTML),Vendor,Product Category,Type,Tags,Published,Option1 Name,Option1 Value,Option2 Name,Option2 Value,Option3 Name,Option3 Value,Variant SKU,Variant Grams,Variant Inventory Tracker,Variant Inventory Qty,Variant Inventory Policy,Variant Fulfillment Service,Variant Price,Variant Compare At Price,Variant Requires Shipping,Variant Taxable,Variant Barcode,Image Src,Image Position,Image Alt Text,Gift Card,SEO Title,SEO Description,Google Shopping / Google Product Category,Google Shopping / Gender,Google Shopping / Age Group,Google Shopping / MPN,Google Shopping / AdWords Grouping,Google Shopping / AdWords Labels,Google Shopping / Condition,Google Shopping / Custom Product,Google Shopping / Custom Label 0,Google Shopping / Custom Label 1,Google Shopping / Custom Label 2,Google Shopping / Custom Label 3,Google Shopping / Custom Label 4,Variant Image,Variant Weight Unit,Variant Tax Code,Cost per item,Status
tropical-mango-ice-disposable,Tropical Mango Ice Disposable Vape 0mg,"<p>Experience the exotic taste of ripe mango with a refreshing icy finish. This disposable vape offers a smooth, nicotine-free vaping experience perfect for on-the-go use.</p>",Vape Co,,Vaping Products,,TRUE,,,,,,,,TMI-DISP-0MG,,shopify,10,deny,manual,9.99,,TRUE,TRUE,,,,,FALSE,,,,,,,,,,,,,,,,,,,active
strawberry-cheesecake-pod,Strawberry Cheesecake Pod System 50mg Salt Nicotine,"<p>Indulge in the creamy richness of New York-style cheesecake paired with fresh strawberries. High-strength nicotine salt for quick satisfaction. Compact pod system design.</p>",Vape Co,,Vaping Products,,TRUE,,,,,,,,SC-POD-50MG,,shopify,15,deny,manual,24.99,,TRUE,TRUE,,,,,FALSE,,,,,,,,,,,,,,,,,,,active
classic-tobacco-pen,Classic Tobacco Rechargeable Vape Pen 6mg,"<p>Traditional tobacco flavor for those who prefer authenticity. Rechargeable pen-style device with low nicotine strength, ideal for former light smokers.</p>",Vape Co,,Vaping Products,,TRUE,,,,,,,,CT-PEN-6MG,,shopify,20,deny,manual,19.99,,TRUE,TRUE,,,,,FALSE,,,,,,,,,,,,,,,,,,,active
peppermint-arctic-aio,Peppermint Arctic Blast AIO Device 12mg,"<p>Intense cooling menthol with fresh peppermint. All-in-one device with moderate nicotine strength. Perfect for menthol lovers seeking an icy experience.</p>",Vape Co,,Vaping Products,,TRUE,,,,,,,,PA-AIO-12MG,,shopify,25,deny,manual,29.99,,TRUE,TRUE,,,,,FALSE,,,,,,,,,,,,,,,,,,,active
mixed-berry-box-mod,Mixed Berry Fusion Box Mod 3mg Freebase,"<p>A delicious blend of strawberries, raspberries, and blueberries. Advanced box mod for experienced users. Low nicotine freebase for smooth all-day vaping.</p>",Vape Co,,Vaping Products,,TRUE,,,,,,,,MB-BOX-3MG,,shopify,30,deny,manual,49.99,,TRUE,TRUE,,,,,FALSE,,,,,,,,,,,,,,,,,,,active
caramel-latte-stick,Caramel Latte Coffee Vape Stick 18mg,"<p>Rich espresso with sweet caramel and creamy notes. Stick-style device with high nicotine strength for heavy smokers transitioning to vaping.</p>",Vape Co,,Vaping Products,,TRUE,,,,,,,,CL-STICK-18MG,,shopify,15,deny,manual,14.99,,TRUE,TRUE,,,,,FALSE,,,,,,,,,,,,,,,,,,,active
